{
  "schema_version": "apxm.port-contract",
  "port_contract_id": "apxm.program-composition",
  "port_contract_digest": "sha256:e54a0b51152830bdcc1262955dc7fe8c390d13de5cae090f17e523c8a41d53dc",
  "semantic_owner": "agents",
  "primary_responsibility": "create or invoke one exact child Program or Program Instance through the admitted root lifecycle without process spawning, target search, or an alternate execution model",
  "request_schema": {
    "schema_id": "apxm.program-composition-request",
    "digest": "sha256:84a8a9a377c95a324286b949a6c9320213cfe3ae6acae7192e4a7ae921ddaa87"
  },
  "result_schema": {
    "schema_id": "apxm.program-composition-outcome",
    "digest": "sha256:f2d1e4320a271e0017696321cf8a32f0d217693d739d5c2b4755415f5ad4048a"
  },
  "failure_schema": {
    "schema_id": "apxm.program-composition-outcome",
    "digest": "sha256:f2d1e4320a271e0017696321cf8a32f0d217693d739d5c2b4755415f5ad4048a"
  },
  "lifecycle_digest": "sha256:c4f894b44e25fa2a183d079e8fadde076d5fc446bcaf13d77b133e5df83b4eab",
  "authority_data_classification_digest": "sha256:6e252a5c3f76b19f9d7f106e14f042e2fcafae46990fc1938e88cd934eb1e2c1",
  "feature_vocabulary_digest": "sha256:095cb0219e3cc72f0c4ec3741778f064d9138f226e4abc417d3a3d75d460c878",
  "configuration_contract_digest": "sha256:590159adae7f29effd5e14f686af4c562906c22187d47df1e396a3bca807bc61",
  "conformance_vector_digest": "sha256:5a1a993543ac0dfc41e5bec8bb409b0e226cba34b540e1c3e803a7f9b6aaf1ad"
}
