{
  "schema_version": "apxm.port-contract",
  "port_contract_id": "apxm.model-inference",
  "port_contract_digest": "sha256:75faad31910d32fb13e1fc93da4d25574a9873a35e948e954abad08c6e676b6b",
  "semantic_owner": "agents",
  "primary_responsibility": "send one exact admitted model request to its already-bound inference implementation and preserve typed terminal, cancellation, usage, and outcome-unknown semantics without selection or fallback",
  "request_schema": {
    "schema_id": "apxm.model-inference-request",
    "digest": "sha256:4980e983dc58417828f292b07814e0262eb1c7ffb9e1a83da32a9586b1ccabe9"
  },
  "result_schema": {
    "schema_id": "apxm.model-inference-outcome",
    "digest": "sha256:2ddb5e5ee5421e4271e1a076b9d2f82f329eb85b2758393018ed8e33cccc3e76"
  },
  "failure_schema": {
    "schema_id": "apxm.model-inference-outcome",
    "digest": "sha256:2ddb5e5ee5421e4271e1a076b9d2f82f329eb85b2758393018ed8e33cccc3e76"
  },
  "lifecycle_digest": "sha256:1bbb59175e3c8e566692d09133c35b45079b62243b30310a46fe5700de208199",
  "authority_data_classification_digest": "sha256:855ce3e43747529e35ca5233b31533d93e59cf6d440911bf6f3bdf93addf8db1",
  "feature_vocabulary_digest": "sha256:5614979abb451bee4c903a78d7522157121f72c7f7a58e8a7b7cddc82260e5fc",
  "configuration_contract_digest": "sha256:e2978241b8f00a3f6cd73b1385963c598aae1ad0657da95436fca0ef90147dfb",
  "conformance_vector_digest": "sha256:f92efd61b3bcf9dfb6bb88a9f403ef573c31178099a00f0259a6cba66519a086"
}
